{"schema_version":1,"event_id":"018bcfe5-6800-7000-8000-000000000001","sequence":1,"run_id":"run-cross-language","task_id":"task-1","session_id":"session-1","turn_id":"turn-1","inference_id":"inference-1","attempt_id":"attempt-1","connection_id":"connection-1","parent_id":"parent-1","pid":42,"container_id":"container-1","source":"hook:hermes","event":"transport_request_started","monotonic_ns":123456789,"wall_time":"2026-09-15T00:00:00Z","raw":{"sha256":"sha256:239f59ed55e737c77147cf55ad0c1b030b6d7ee748a7426952f9b852d5a935e5","size":7,"media_type":"text/plain"},"normalized":{"method":"POST"},"redaction":{"policy":"default","fields":["authorization"],"omitted":["cookie"]},"confidence":0.9,"evidence":["hook","proxy"],"terminal_state":"complete"}
